제목,이미지URL,촬영장소,사진작가,검색키워드,콘텐츠ID,콘텐츠타입ID,등록일시,수정일시
대천해수욕장,http://tong.visitkorea.or.kr/cms2/website/86/1074486.jpg,충청남도 보령,한국관광공사 김지호,"대천해수욕장, 해변, 바다, 바닷가, 여름, 물놀이, 보령8경",1074486,17,20100816130254,20150828150259
대천해수욕장,http://tong.visitkorea.or.kr/cms2/website/90/1074490.jpg,충청남도 보령,한국관광공사 김지호,"대천해수욕장, 바다, 바닷가, 여름, 물놀이, 피서, 바나나보트, 보령8경",1074490,17,20100816131219,20150828150227
대천해수욕장,http://tong.visitkorea.or.kr/cms2/website/94/1074494.jpg,충청남도 보령,한국관광공사 김지호,"대천해수욕장, 바다, 바닷가, 여름, 물놀이, 피서, 보령8경",1074494,17,20100816131711,20150828150127
대천해수욕장,http://tong.visitkorea.or.kr/cms2/website/95/1074495.jpg,충청남도 보령,한국관광공사 김지호,"대천해수욕장, 바다, 바닷가, 여름, 물놀이, 피서, 보령8경",1074495,17,20100816131844,20150828150053
대천해수욕장,http://tong.visitkorea.or.kr/cms2/website/24/1142624.jpg,충청남도 보령,한국관광공사 김지호,"대천해수욕장, 바다, 해변, 모래사장, 여름, 보령8경",1142624,17,20101207154205,20150814193228
대천해수욕장,http://tong.visitkorea.or.kr/cms2/website/65/1142665.jpg,충청남도 보령,한국관광공사 김지호,"대천해수욕장, 바다, 모래사장, 여름, 보령8경",1142665,17,20101207155244,20150814193141
